{
    "schema_version": 1,
    "experiment_id": "example-foundation-manifest",
    "created_utc": "2026-07-30T00:00:00Z",
    "git_commit": "0000000000000000000000000000000000000000",
    "git_tree_dirty": false,
    "command": "python -m deepbook.experiment --config configs/example.yaml",
    "config_paths": ["configs/example.yaml"],
    "config_hashes": {
        "configs/example.yaml": "sha256:0000000000000000000000000000000000000000000000000000000000000000"
    },
    "status": "planned",
    "notes": "Example manifest for schema validation. No experiment has been executed.",
    "deviations": []
}
